{
  "event_id": "0197a3c2-7d10-7b11-8a52-3f1e9c0a1111",
  "run_id": "0197a3c2-5a00-7c00-9f00-000000000001",
  "seq": 12,
  "occurred_at": "2026-10-16T10:15:30Z",
  "clock_kind": "WALL",
  "actor_type": "HUMAN",
  "actor_id": "approver-1",
  "role_string": "Reviewer",
  "credential_id": "cred-approver-01",
  "action": "APPROVAL_RECORDED",
  "subject_type": "GATE",
  "subject_id": "gate-arch-1",
  "from_state": "OPEN",
  "to_state": "APPROVED",
  "result": "SUCCESS",
  "reason": "Design reviewed against FR-006 and FR-017; approved",
  "policy_version": "v1.0",
  "correlation_id": "0197a3c2-5a00-7c00-9f00-000000000001",
  "causation_id": "0197a3c2-7d0f-7a00-8a52-3f1e9c0a1110",
  "data": { "gate_key": "G-ARCH" },
  "prev_hash": "5c1a0f0e9b8d7c6b5a4938271605f4e3d2c1b0a99887766554433221100ffeed",
  "hash": "9e8d7c6b5a49382716f5e4d3c2b1a0ffeeddccbbaa99887766554433221100ab"
}
